{
  "schema_version": 1,
  "record_type": "network-profile-generation",
  "device_id": "target-lab",
  "media_instance_id": "media-lab",
  "target_binding": {
    "schema_version": 1,
    "system_uuid": "12345678-1234-1234-1234-123456789abc"
  },
  "runtime_sha256": "aaaaaaaaaaaaaaaaaaaaaaaaaaaaaaaaaaaaaaaaaaaaaaaaaaaaaaaaaaaaaaaa",
  "files": {
    "Home Wi-Fi.nmconnection": "bbbbbbbbbbbbbbbbbbbbbbbbbbbbbbbbbbbbbbbbbbbbbbbbbbbbbbbbbbbbbbbb"
  }
}
